id,name,tag,description,features,fromPrice,photo,sortOrder,active
cb_mr5l7lro0fde18f849,Roll-Up Door,POPULAR,Single or double roll-up doors for easy forklift access.,8×7 roll-up|Galvanized steel|Lockable,3200,,1,true
cb_mr5l7lrp650eb9f194,Personnel Door + Window,COMMON,Man door and sliding window for office or site use.,"36"" steel door|Deadbolt|Slider window",2800,,2,true
cb_mr5l7lrp3a18a1ae1f,Workshop Container,TURNKEY,"Wired for power, vented, shelving included.",110v outlets|Fluorescent lighting|Vent fans,5500,,3,true
cb_mr5l7lrp580d942432,Pop-Up Retail Shell,TRENDING,"Fold-out panels, branded exterior, ready for signage.",Fold-out counter|Service window|Awning mounts,7200,,4,true
cb_mr5l7lrp7b02c711cd,Security Vault,HEAVY DUTY,"Reinforced doors, CCTV mount points, alarm wiring.",10-gauge steel door|3-point lock|CCTV prep,4400,,5,true
